{
  "$hsa_kind": "cer_reference",
  "$hsa_contract_version": "1.0.0",
  "strategy_id": "gold_context_breakout",
  "strategy_version": "1.0.0",
  "experiment_id": "FIXTURE-EXP-GOLD-0001",
  "run_id": "FIXTURE-RUN-GOLD-0001-A",
  "evidence_id": "FIXTURE-EVID-GOLD-0001-PROMO",
  "artifact_id": "FIXTURE-ART-GOLD-0001-PROMO-report",
  "reference_type": "PROMOTION_EVIDENCE",
  "source": "CONTRACT_FIXTURE",
  "summary": "Evidence offered in support of promoting gold_context_breakout 1.0.0: the package's stated acceptance criteria were met over the declared minimum sample.",
  "recorded_at_utc": "2026-09-02T16:20:00Z",
  "supports": "PROMOTION"
}
