{
  "$hsa_kind": "cer_reference",
  "$hsa_contract_version": "1.0.0",
  "strategy_id": "gold_context_breakout",
  "strategy_version": "1.1.0",
  "experiment_id": "FIXTURE-EXP-GOLD-0002",
  "run_id": "FIXTURE-RUN-GOLD-0002-A",
  "evidence_id": "FIXTURE-EVID-GOLD-0002-REVISION",
  "artifact_id": "FIXTURE-ART-GOLD-0002-REVISION-report",
  "reference_type": "REVISION_EVIDENCE",
  "source": "CONTRACT_FIXTURE",
  "summary": "The shape a REVISION_EVIDENCE reference takes for a candidate revision. It is anchored to 1.1.0, not to 1.0.0: a candidate must pass the governed evidence gates again and inherits no verdict from the version it supersedes (PID line 189). Shape only — no 1.1.0 exists in strategies/ and no gate has been evaluated.",
  "recorded_at_utc": "2026-09-03T15:40:00Z",
  "supports": "REVISION"
}
