{
  "$hsa_kind": "cer_reference",
  "$hsa_contract_version": "1.0.0",
  "strategy_id": "gold_context_breakout",
  "strategy_version": "1.0.0",
  "experiment_id": "FIXTURE-EXP-GOLD-0001",
  "artifact_id": "FIXTURE-ART-GOLD-0001-hypothesis",
  "reference_type": "STRATEGY_HYPOTHESIS",
  "source": "CONTRACT_FIXTURE",
  "summary": "Hypothesis under test: a higher-timeframe trend context plus a lower-timeframe breakout trigger produces a positive-expectancy setup on XAUUSD.",
  "recorded_at_utc": "2026-09-01T09:30:00Z",
  "supports": "INFORMATIONAL"
}
